how early do fetus' feel pain,,
peter macneill actor,,
how long should vacation time cash out when resigning from a job,,
what is definition of stunning,,
how to pronounce eamon,,
what does in stature mean,,
what does a dream represent,,
who made ode to joy,,
who replaced richard nixon as president,,
what does geeky means,,
how many manned apollo missions landed on the moon,,
what natural resources is metal made of,,
was gary cooper .the real name,,
opaline means what as a name,,
what is sangrona,,
who replaced cliff burton in metallica,,
who is esther jones,,
where is americus ga,,
biology definition of barr body,,
who made butterfly choreography,,
what is a lob cut,,
who is fred jones education,,
david haye how tall,,
what was william carey famous for,,
what does reclast treat,,
when did stephen sauvestre die,,
how how old is bernie sanders,,
what is a leader of mexico,,
how mark cuban got rich,,
what does ground zero mean?,,
what type of noun is lawmaker,,
what empire did pizarro conquer,,
why did michael jackson get divorced,,
what age group is the baby sitters club series,,
how many days after your period is your next cycle,,
what is a pericles,,
how old is ken shamrock,,
when did bill clinton became president,,
how to lose 6kg in 2 weeks,,
migraine infusion treatment side effects,,
who sings fever,,
when did bonanza first air on tv,,
how long do fly eggs live,,
who was seal's wife,,
define planwise,,
is citibank a corporation,,
is olanzapine a narcotic,,
who was the first admiral of the united states navy,,
what meds are for vertigo,,
who is russell henry?,,
ronnie poker,,
how long into a pregnancy can you tell what sex it is,,
why do they call it irish twins?,,
is milk made of cells,,
what is microsoft assist,,
What does the name Roman mean,,
bob corker yearly salary,,
did casablanca win an academy award,,
weather in israel in december,,
what is e.i.n,,
who was lloyd alexander married to,,
how many slams has murray won,,
what is the fra,,
what's the meaning of snag,,
life is strange game price,,
who is patrick duffy married to,,
how long to pressure cook chicken,,
hms hero,,
when did viking age began,,
what is the strongest material in the world,,
did clyde drexler get divorced?,,
how old is harris j,,
what happened to president nixon,,
why are voluntary muscles also known as skeletal muscles?,,
what stages of piaget is toy sharing,,
is the baby giraffe died,,
what day was martin luther king assassinated,,
vitamins take when pregnant,,
who played carol brady,,
what is the meaning of finessed,,
effects of anemia during pregnancy,,
what did zacharias janssen discover and what year,,
who sang all these years,,
otezla side effects heart,,
what is age of majority in bc,,
average monthly temps,,
what does it mean when something is dense,,
who has played lex luthor?,,
when is the election for us senator alabama,,
where is the feedback loops used,,
shingles symptoms wikipedia,,
how old is elliott john,,
who is edward,,
who is jeff in real life :o,,
why do people flirt,,
what helps thicken uterine lining,,
when is john quinones birthday,,
does writing dialogue come in it's own paragraph?,,
who sings i never knew love like this before,,
grace vanderwaal instagram,,
what should the oxygen level in your blood be?,,
how old is tippi hedren right now,,
communique meaning,,
taxi tv series cast,,
is the name elvia english,,
what kind of cancer did john coltrane have,,
what is a favorite hobby of people in chile?,,
how much water should a dog drink in a day.,,
what channel is love it or list it on,,
biblical hebrew word meanings,,
what does the civil rights act of 1875 outlaw,,
how many carbs per meal for diabetic plan,,
what did mohandas k. gandhi protest for,,
meaning of sacrifice,,
what is the tiniest bug,,
what is good to eat when you need more vitamin d,,
what lab findings diagnose kidney stones,,
turner syndrome heart defects,,
how common is bleeding during pregnancy,,
has the wendy williams show been cancelled,,
what movies has the quote love means you never have to say your sorry,,
what is period length means,,
how old is judith guest?,,
who is general robert b abrams?,,
what scientific contributions did neil degrasse tyson do?,,
how many weeks to get back to birth weight,,
what does dislike mean,,
what was the importance of samuel slater in american industry,,
how old do kids need to be to ride metro,,
where was the uss nautilus stationed?,,
who was moses judah?,,
where's ecuador,,
how much daily vitamin d,,
how many days after ovulation can i tell i'm pregnant,,
who was connie sawyer,,
what is the meaning of sagacity,,
which is a disease of the lungs?,,
onion meaning in dreams,,
slang word thot meaning,,
definition of pharisee,,
definition headache,,
what age can babies first see,,
what is dpca,,
who is the holy spirit john piper,,
the three parts of the information-processing model of memory are,,
who e=mc,,
how is a baby baboons life,,
tsun meaning,,
which ruler founded the mughal empire? akbar babur suleiman mehmet,,
how selected for jury duty,,
where is nora located,,
youngest billionaire list,,
what are the responsibilities of a seller,,
how long is dog pregnancy term,,
when did bob dylan wrote you gotta serve somebody,,
who were the fascists,,
what is the republic of salo,,
when was trippie redd born,,
who is bob eubanks,,
cause of balance problems in cat,,
what year was the butterfly effect released?,,
foods that help boost fertility,,
what does heart of a warrior mean,,
what was john tyler,,
how old is georgia engel,,
what is the meaning of second,,
is a flower an organism,,
what pier does harmony of the seas leave from,,
what does the name nicholas mean in italian,,
dr dieter martin license number,,
how much money is billy graham worth,,
which hand to wear engagement ring on after proposing,,
is ketamine a horse tranquilizer,,
biggest bat recorded,,
what do teeth represent,,
when was michael jackson fire pepsi ad,,
who is lupita nyong,,
celeberties with the birthday september 17,,
how long does it take to heal ribs,,
who is chris fisher,,
when is college softball world series,,
ice skating rink temperature,,
what genre is rob thomas,,
how did paul walker die.,,
what is the meaning of the name Helena?,,
who was obama running against,,
candy meaning,,
when was jesse williams born,,
what show is william h macy on,,
who was the judge for larry nassar,,
when was benedict cumberbatch?,,
when was dna discovered,,
what did the hollywood sign used to say,,
breadcrumbs definition,,
wfan new hosts,,
how much is johnny manziel worth,,
meaning of name bee,,
who performs an echocardiogram,,
what is unleashed,,
who was thomas hindman,,
benefits of iud for heavy periods,,
what does estrogen control,,
what kingdom hearts character,,
last name meaning gavin,,
which team jeremy lin play,,
who is kyle rudolph wife,,
is bernard shaw still alive,,
who is the president of djibouti?,,
how old is justine skye,,
zara meaning,,
when should baby say words,,
who is sigrid thornton?,,
when did trump marry ivana,,
what can relieves morning sickness,,
what was dwight d eisenhower accomplishments,,
when did shon harris die,,
what is the cause of abnormal sperm morphology,,
who is aicantar skyrim,,
who is samura kamara?,,
who amber rose dating now,,
is a pregnant person supposed to eat pork,,
who sings gangnam style,,
who is siri?,,
how often do i need a pap smear test,,
what schools did rockefeller go to,,
what town did jfk die in?,,
weather channel meteorologist cancer,,
menopause lasts how long,,
which inca ruler expanded the empire the most,,
where did yeats live,,
which cell is present in the ovary at birth?,,
how long is pregnancy in a cat ?,,
what is oliver twist ask,,
what is the name of price is right announcer,,
is endometriosis caused by hormones,,
how to teach toddlers their colors,,
is the statue of liberty torch open,,
define mitochondrial,,
how old is burton cummings,,
who sang come prima,,
what did akon go to jail for,,
who narrated the fugitive tv series,,
how accurate is the plus negative pregnancy test,,
who is mystic meg,,
who is samuel malao,,
conan actor,,
is it possible for stress to make my cycle late,,
body temperature ovulation,,
who plays roscoe on house of lies,,
cinderella diet ideal weight,,
how important is a governor,,
most common age for vasectomy,,
who roy moore lost to,,
voice of chef on south park,,
how old is stephen jones,,
how long does it take for milk to dry up after having a baby,,
who is sydney simpson,,
what channel was desperate housewives on,,
who is candace from the haves and the have nots,,
does morning sickness mean healthy pregnancy,,
what is the smartest thing in the world?,,
what is dove cameron's name,,
hayley mcneff,,
define fortuna,,
what is oj simpson doing,,
founder of buddhism and what century,,
what party is governor of florida,,
what unit was bergdahl assigned to,,
who does brett lowrie play baseball for,,
how many shootings when trump was in office,,
how long isaac live,,
is paladins cross platform,,
pat mcafee net worth,,
age for infant to hold up head,,
what kind of name is prakash,,
where to find hestu,,
what does viktor mean name,,
what season of homicide dealt with luther mahoney,,
menopause and emotional effects,,
how long does it take for cats to deliver there kitten,,
definition of womanism,,
who plays storm in days of future past,,
how long does a sperm survive in a human body,,
how early can you feel the baby move in the womb,,
what album was dear jessie on,,
what position did babe ruth play in 1914,,
what is elvis presley's estate worth,,
how long is super bowl,,
what style of coat does dazai wear,,
did george go to school,,
where is devin logan from,,
grey gardens cast,,
who is xerxes,,
what year was driving miss daisy set in?,,
what are the croo,,
when should you start having prostate exams,,
what does it mean to have an inheritance in christ,,
who is the lead singer of lovin spoonful,,
how does milk thistle mimic effects of estrogen,,
what does pms mean for period,,
who is trent garrett,,
how old is phyllis francis,,
who is the actor that plays skinner on the x. files,,
who wrote chandelier,,
what draws nick to gatsby,,
what are functionally optimal thyroid levels during pregnancy,,
who wrote the last train to clarksville,,
where is a boogie rapper from,,
has alison krauss ever been married,,
meaning of the name erika,,
what methods did the suffragists use to get the vote,,
who's the shortest president,,
what is dua lipa,,
how could you help children to relax when they are overstimulated or tired,,
at what age do guys stop growing,,
how old is veronica campbell,,
meaning of the name pankaj,,
what causes left axis deviation on ecg,,
how long do cardinals sit on eggs,,
when did kings emerge,,
who has recently left wwe,,
what fies name brian mean,,
is there a law against breastfeeding in public,,
where did doris miller go to school,,
what does shadow the hedgehog do,,
who plays as the trolls characters,,
how long should it take for a chihuahua to give birth,,
when did june carter cash die and johnny cash,,
what's there names did dr seuss publish books under,,
what is childbirth,,
what college did shaquille o'neal go to,,
who is aikido,,
what episode does luffy defeat crocodile,,
what is ragnor,,
what is the role of the vice president of the united states?,,
what was plato's philosophy,,
cortana what do you do in the work,,
what was cesar chavez's childhood like,,
when did sinclair lewis die,,
what is wilt chamberlain famous for,,
archimedes meaning,,
what is justin's favorite color,,
how much does judge judy make a year,,
another term for starting period,,
how tall is doris day,,
who is thurgood marshall,,
why was poe known as the master of the macabre?,,
what is a mini hippo,,
what year did the movie alice sweet alice,,
vidya vox,,
what did huell die of,,
how much weight to gain during pregnancy,,
who plays in victorious,,
what are bats,,
who is tristin mays,,
dr craig hamasaki phone number,,
who plays xander from bunkd,,
where did crying uncle originate,,
weaning doberman puppies,,
which president could was also talented with music,,
where is rene fonck buried,,
who is the director of titanic,,
what does horatio agreed to do,,
how much does matt lauer make a year,,
does menarche ever occur before the growth spurt,,
how old should dogs be to be spayed,,
where is charles goodnight buried,,
why is medgar evers important to black history?,,
list of symptoms of heart attack for men and women,,
who is robert trott,,
fergie worth,,
what can cause late periods,,
where did trump go to college and grad school,,
what radio station and time is dave ramsey on in colorado,,
when does belly start to grow pregnancy,,
who is dane cook?,,
who is charlie wilson,,
aristotle teleology definition,,
room cast,,
at how many weeks does a fetus start to move inside the womb?,,
what is a d.o. vs m.d,,
obstetrician define,,
where is drew carey from,,
who is rachel peden,,
what was sean spicer's salary,,
human nature define human nature,,
which is an example of malingering?,,
calories burned breastfeeding,,
how tall is pitbull the rapper,,
how much weight to gain second trimester,,
when was tracy morgan's accident,,
what is a clit,,
comedian who said what had happened was,,
what was the length of jurgis' jail sentence?,,
what day did audie murphy die,,
what was the feminist movement,,
what is the climax of the marigolds,,
who played penny proud,,
is trisha yearwood divorced from garth brooks,,
who was lead singer of cream,,
what book is jean valjean in,,
provera medication,,
grooveshark founder,,
usher child how old,,
who composed the ballet of sleeping beauty,,
what are some of the side effects of hrt,,
who is edie gorme's husband,,
which african american was born into slavery and became a famous leader?,,
where did ferdinand die,,
how do wild cats visually communicate,,
who is known as the romantic hero,,
why do puppies lick their owners,,
how old is seth curry,,
what eye condition does danelle umstead have,,
is hormone therapy with radiation for prostate good,,
what causes sore cervix,,
list of harry potter actors who died,,
who played original alfalfa,,
bae doona net worth,,
how many years has clive bundy not paid for grazing on blm land,,
how many grams sugar in soda,,
what does natural selection explain the diversity of species darwin observed on the galapagos islands,,
who is atlanta falcons starting quarterback,,
how many kids vanessa lachey have,,
who is tommen in game of thrones,,
where is clarkes beach in nz,,
gargamel wizard the smurfs,,
who wrote chaka khan i feel for you,,
who is warden magellan?,,
dorcas meaning of name,,
who is colonel sherburn,,
did celine dion really have a nose job,,
what is Homo floresiensis,,
why is tupac famous,,
are david duchovny and tea leoni divorce,,
who is sean hannity,,
who is dead from the sopranos cast,,
is lara spencer married,,
what were constantine's accomplishments,,
how fast is the heartbeat of a fetus,,
what does diablo mean in spanish,,
is megyn kelly staying on nbc?,,
what causes consistant Gardnerella vaginalis,,
what is the function of the progesterone?,,
meaning of sirin,,
does metformin affect baby's poop breastfeeding,,
who owns boch toyota,,
should i vaccinate my puppy pug with hepatitis,,
what did chopper read die of,,
how did leopardfoot die,,
who is omar khayyam,,
who was the model for the statue of liberty,,
what is a cycle for periods,,
how old is tori spelling?,,
who is castiel closest to in supernatural,,
who is tim farmer,,
alabama is known for producing,,
where was bowlby born?,,
who is fatoumata diawara ?,,
what show stars corey matthews,,
at what age can a kitten get felv vaccine,,
when is the soonest you can take a pregnancy test,,
what why is your name cortana,,
how tall is constance towers,,
how much is bruno mars's net worth?,,
is bartok an italian name,,
where did frank drake work,,
tita name meaning,,
when can you start feeling baby kicks,,
who plays geppetto,,
when did buddhism begin,,
did betty white ever have children,,
average gestation period for an elephant,,
is gov bentley a democrat,,
how many delegates does trump need to win,,
where is santa de lucas located,,
who was gargamel's cat,,
how long do eggs last after chickens lay,,
team player definition,,
how to get a period started,,
how old are polar bears when they first have a cub,,
what actor won an oscar for ordinary people.,,
what is theme of pygmalion,,
who is art modell?,,
what is a gucci gang,,
who was the president of england in 1939,,
chloe movie cast,,
when did the victorian poetry era end,,
does a chinese bride take husbands name?,,
when was the queen born,,
did the actress who played sally spectra die,,
what age do you screen cholesterol peds,,
cost to be a scout,,
who starred in easy rider?,,
who was the first black astronaut,,
who is diva thin muffin,,
why did the firemen burn books in fahrenheit 451,,
who was the kid who played dueling banjo in the movie,,
when in a cycle do you ovulate,,
which organ is responsible for testosterone,,
what position does lamarcus aldridge play,,
who is willis blackshear,,
how much to actresses,,
duration of medical menopause,,
where is uma located,,
what theory did whorf come up with,,
what is hades most famous for,,
what is simon cowell net worth,,
what is the safe glucose level for a pregnant person,,
how many brothers and sisters did martin luther king have,,
what does borderline pre menopause mean,,
who is haha davis,,
what is charles darwin famous for,,
who sang with iggy,,
how much is kristi yamaguchi worth,,
does the start of menopause cause tiredness,,
francys johnson attorney,,
when did mark twain write letters from earth,,
why did charles lindbergh fly across the atlantic,,
what did leo h. baekeland invent,,
average time for sperm to reach egg,,
who does trent cole play for,,
what is usdt crypto,,
do you know who master chief is,,
who is everlast,,
The Populist candidate for governor in 1894 was,,
tv series benson cast,,
who sang shout,,
what was the name of marco polo book,,
who was oprah winfrey,,
how tall is steven van zandt,,
how much vitamin d should you take during pregnancy,,
who discovered aluminum and when,,
what music video was keanu reeves in,,
what did the torch of the statue of liberty mean,,
who was the mentor to hercules,,
who is the clown in the movie it,,
nidhi what kind of name,,
who invented the light bulb first,,
rhonda conley cnm npi number,,
who is tantor,,
what is delilah,,
who is tom fletcher,,
who is princess beatrice of york dating,,
was lavender brown a slytherin,,
what age do you go through menopause uk,,
how long is a cat pregnant for,,
what is seamus o'regan doing now,,
what are the signs of pregnancy?,,
where did linda stouffer go on the news,,
what anime is hinata,,
what did mendel discover about genetic factors in pea plants?,,
where did elvis die at,,
how many days before you can x ray a pregnant dog,,
yumi what ethnicity is that name,,
meaning name hudson,,
doris burke age,,
where was booker t. born at,,
define yaoi,,
name meaning - kalie,,
who was a.p. carter,,
how long after giving birth can you work out,,
who was the first president to leave the us while in office,,
who invented the plow,,
how many days ovulation occur,,
how many carbs per day gestational diabetes,,
when was octavia born,,
who is the head coach at kansas state university,,
what does hymen mean,,
how many died because of dirt bikes,,
when does baby move from pelvis,,
when can you feel signs of pregnancy,,
define snarker,,
which cartoon was boris badenov,,
what scene does laertes die in hamlet,,
what's the meaning of adia,,
what is the definition of hombre?,,
who is soflo,,
what are the type of gametes,,
kouros meaning,,
who spent ten years writing the aeneid,,
when was dio brando born,,
who is benjamin indra,,
how often do you need a pap exam,,
how samsung got its name,,
ty cobb significance,,
who is deadpools enemy,,
kinipela name meaning,,
what tv shows did maggie q star in,,
what age should a teen begin using tampons,,
what year was the uss randolph designated cva,,
steve depass how old,,
how many quads does nathan chen do,,
what movie is maddie ziegler,,
how many days after ovulation can you take test,,
what county is taberg ny in,,
how strong was broly,,
rousey/holm fight,,
when does pregnancy take place after intercourse,,
was fdr in a wheelchair,,
who is samuel f b morse,,
the meaning behind emperors new clothes,,
who plays penelope garcia on criminal minds,,
who was alima,,
who sings let it ride?,,
what is hermione's middle name?,,
what person has the biggest feet,,
who is the character oliver mellors,,
is estrogen safe,,
how long is formula in a bottle good for,,
who is vanossgaming,,
how manga is made,,
fallout what happened to the vault dweller,,
where was athena at parthenos found,,
who is the san fernando mayor,,
what is mammogram screening,,
when did hh holmes die,,
where did gregor mendel die,,
what has donald trump said about immigration,,
when do you know if you start your period,,
fey meaning,,
definition of mal-intent,,
what is undyne gender,,
what kind of leader was stephen cambone,,
time zones sanford fleming,,
how to become labor and delivery nurse,,
is cordell broadus on the ucla football team,,
what is the roman name for athena,,
what did hooke observed in the cork slice,,
what year was the bachelor released,,
in what city was the movie giant filmed,,
what is the name over pooh's door,,
most wins in jeopardy,,
where was keke palmer born,,
is madara the leader of the akatsuki,,
how old is richard petty,,
who is richard mason,,
where was howlin wolf from,,
how many videos has sal khan made?,,
lassie meaning,,
where is mogadishu?,,
what is a menopause,,
which college did newton attend,,
when is miriam makeba birthday,,
how old is gus birney,,
who is the best quarterback in nfl history?,,
glen officer shot in detroit,,
how often should i have a mammogram,,
what does the hyde amendment prohibit?,,
did Desiderata of the Lombards have any kids,,
what kind of work does sistersong do?,,
what is a prophylactic mastectomy,,
what grade is frankenstein read,,
how did yuri gagarin die,,
how often do dogs come in heat,,
is mendeecees still in jail,,
who is ross in macbeth,,
what are the symptoms for pregnancy,,
who is the highest paid actress on television,,
who is rep. brad sherman,,
who has a child named olive,,
who is gov talmadge,,
time period of mary cassatt,,
what does justin theroux do,,
when to do double mastectomy,,
what's the actor's name that plays deadpool,,
who was president in 1974,,
turner's syndrome cardiac defects,,
definition about truth as plato's e,,
what is bird's salary on judge judy,,
where is bettis,,
connie britton worth,,
up to what age do you need a pap exam,,
pap smear what age should you get it,,
what is colostrum,,
difference in bleeding when menstruating,,
when is the queen of england's birthday going to be celebrated,,
where was roosevelt from,,
did jim butcher get divorced,,
are prenatal vitamins good for you if you are not pregnant,,
most pitches nolan ryan threw in a game,,
what is rapper futures net worth,,
what is a fibroadenoma on you under arms made of,,
what was the name of brooke shields character in blue lagoon,,
who is zebulon vance,,
symptom of too much testosterone,,
when was ireen wust born,,
what is ferg,,
when should mammogram,,
what does masculinity have to do with violence,,
what president supposedly got stuck in a bath tub at the white house,,
how does abortion affect fertility,,
how can a mammogram diagnose cancer,,
where is pusha t from,,
when was macon bolling allen born,,
what year did kingpin come out,,
gabbie hanna net worth,,
what is mawmaw,,
when do kids start to walk,,
what kind of car does ken block drift in,,
what does nambla stand for,,
what ymca did dale carnegie teach at?,,
who is pete burns,,
when can one ovulates,,
how long does it take for a horse to give birth,,
how old baby smile,,
who played the wife in bernie mac show,,
who much is connie britton worth,,
what type of horse is bojack horseman,,
what kind of pickups does kirk hammett use,,
can you take depo shot early,,
does bbt drop before ovulation,,
where is bre,,
what year did william howard taft win the election,,
what state is chesapeake shores filmed,,
how deep is the average vaginaa aroused,,
benefits of theophylline,,
what does mafatu mean,,
what to do for autistic meltdown,,
who is the governor of ny?,,
famke janssen how tall,,
what year was demosthenes born,,
what is a suffragist,,
who plays lily potter,,
when was meta fuller born,,
how much is tiffany haddish worth,,
causes of sudden ed,,
how long does it take for you to be able to tell if your dog is pregnant,,
is it normal to bleed after sex before my period,,
how many months between the end of a dog's cycle and the next one,,
who is george pullman,,
who played sirius black,,
are strapless wedding dresses out of style,,
where is saba,,
where is eugene?,,
who is goddess of wisdom,,
who is zecora,,
who is galvatron,,
dog day afternoon cast,,
camella rodgers,f,
who is the richest rapper,,
procedure to move the baby in the womb,,
what are bindis,,
what causes hot flashes?,,
what is the area inside the labia called,,
who was rapper doc,,
how did the chariot racing begin,,
define emasculate,,
who was max moon in wwe,,
who sings your my angel,,
what does estrogen do?,,
what's a charlatan,,
what year did survivor record eye of the tiger?,,
what did brian piccolo die from,,
how old is betsy kling,,
when was cinderella,,
what is a bikini surgery,,
how much a 6 month baby sleep,,
who wrote winnie the pooh original,,
was squeaky fromme released,,
what is the real name of master chief,,
what was gwendolyn brooks accomplishments,,
don youngblood cause of death,,
how many kids trump have,,
what is ansel adams most famous photograph,,
what is a convent,,
hormonal treatment for menopausal symptoms,,
what group was ozzy osbourne in,,
