who sings because i want to fall in love,,
why is the venus,,
can you test a day before missed period,,
how old is chloe moretz,,
where is greenwood la,,
what is the book emma by jane austen about,,
how tall is a mature giraffe,,
most well known entrepreneurs,,
what is the glandular tissue and where is it located,,
is herceptin an aromatase inhibitor?,,
who did carter run against for president,,
who refused to leave mt st helens,,
how long can someone live without water,,
how many people signed declaration of sentiments,,
how long do you pie blood after bladder op,,
did britain know the us would drop an atomic bomb,,
how long should i cramp while pregnant,,
who sing la la la old song,,
where was loretta lynn born?,,
who sings games,,
what is legal age for consent in michigan,,
what does clean hands mean,,
what are tom animale,,
what is the function of mitosis in a cell that is about to divide?,,
who has eric hosmer,,
what network is supergirl on,,
how wide is a golf ball?,,
allure of the seas cruise ship specs,,
common symptoms seen in hiv,,
how much does it cost to do taxes?,,
another name for excessive bleeding,,
what company makes flonase,,
when was ufc 2,,
who is mario,,
how much zinc to take when pregnant,,
what is prison like,,
who fought general lee,,
who wrote self reliance,,
when do babies pick up stuff,,
when is testosterone too low,,
what state was grover cleveland elected from,,
when did president roosevelt die?,,
where does barron trump go to school,,
horse time of ovulation,,
perplexed definition,,
how did skip waters die,,
how much is lara flynn boyle worth,,
types of human rights violation,,
enrique means what in english,,
are original loan docs required to be kept,,
what to do if cockatiels is sick,,
who is a billionaire,,
who owns truth or fiction?,,
occurrence population for hiv,,
what show is lou dobbs on?,,
meaning of the word jessie,,
who are jeff dunham?,,
what did gold miners go through,,
what gen is spoink,,
what college did james monroe,,
who is actor sudheer,,
who is larry keigwin,,
what labs and symptoms for appendicitis,,
i pound gold how many grams,,
bojangles breakfast hours,,
who is rosario dawson curr,,
how old is justin bieber now,,
what age do you wean kittens,,
when was the first cell phone called,,
what age does bph start,,
who is julia b,,
was richard nixon an alcoholic,,
how long will a feral cat disappear after surgery,,
what is sexism,,
when did shoes that fit start,,
richard wright education what school you attend,,
how old is taylor reilly,,
where was donald trump from,,
when does a blighted ovum miscarry,,
who wrote sometimes love just ain't enough,,
what movies did amy adams star in,,
what is das for,,
what is crippling arthritis called,,
ellianna name meaning,,
hebrew meaning of wilderness,,
who is john brandis,,
typical weight gain in pregnancy,,
what age should i transition out of crib,,
was charlie chaplin an artist?,,
how many champions did bob knight win,,
how early can you feel flutters in pregnancy,,
what age to babies begin babbling,,
who sings paper dolls with rob thomas,,
how tall was tupac?,,
what is the definition paternity,,
who is rabbi schneider,,
what year was the movie i can do bad all by myself (play) released,,
why is my urine crystal clear?,,
where was james chaney buried,,
when can you feel your baby kick in pregnancy,,
how often do you feed newborn,,
what time is it in runcorn uk?,,
why chris pratt divorce,,
who played catwoman,,
how to comfort a kitten,,
who plays abby donovan,,
where was shane harper born,,
how long does a cough last in infants,,
marriage is an icon of god's love for us,,
who was john dee the astrologer,,
what does terrie mean,,
which scientist proposed the first formal theory of continental drift?,,
at how many months do babies start saying word,,
what does write a citation mean,,
when was vaccine for aids invented,,
what year are the polka dots dresses,,
when does thanksgiving,,
when to give a baby yogurt,,
what types of vegetables do budgerigar love,,
explorer who completed the circumnavigation of,,
when was kennedy assassinated,,
what is the meaning of spinster,,
how long to cook a 1 1/2 pound pork roast in a bag in the oven at 400,,
what does npsf stand for,,
who is the don in mafia,,
when does luther return,,
is eric trump's wife jewish,,
who created wreck it ralph,,
who is shauna niequist,,
what is the humanitarian award,,
what decade did the innocence project begin,,
how old is warren jeffs?,,
what year did mesopotamia begin,,
can you eat bacon when pregnant,,
how many days between dogs coming in heat,,
when is ride the rockies,,
where is leah messer live,,
how do you give someone time and space without losing them to another person,,
what was dr seuss' nationality,,
how much did the nra give to the trump campaign?,,
when was vinci italy established,,
when was the chanel flap bag created,,
how did harriet tubman help the slaves ?,,
who hit the first home run for baltimore orioles,,
cast of santa clause,,
what snl actor was on the office,,
is there always implantation bleeding and cramps when pregnancy begins,,
how old is charles robinson,,
who wrote. if i ever get lucky. merles song,,
what is shawty mean,,
what is a gem report?,,
gold the tenrec,,
hg pregnancy sickness,,
where is lil wayne from,,
nakoa name define,,
at what age do puppies get first set of shots,,
what is gabrielle,,
macy name origin meaning,,
analects of confucius,,
what is menorrhagia mean,,
mark zuckerberg dropout harvard,,
how many times has a la lakers player been awarded mvp,,
what kind of bull was bodacious,,
what does the name oceania mean in geography,,
who was samuel jones,,
what year were hot rods made,,
is fenugreek safe for pregnancy,,
symptoms for premenopausal,,
what was king's most famous speech,,
who is princess diana's niece,,
how long should soreness last after needles in back,,
can itachi beat madara,,
which colony was governed by lord de la warr,,
what is the dot called that indians wear,,
what are the drupes,,
how old is diplo,,
nreca how long does it take to get a loan,,
who was great britain's leader,,
meaning of tuck-a-hoe,,
bruce lee weight,,
how tall is kris kristofferson,,
who starred in. pursuit of happyness?,,
how long does a herpes outbreak last,,
can hcg affect your thyroid,,
what building is carnegie named after,,
what does betrothal mean,,
what years does downton abbey span,,
cortana what is magnetic,,
what is the oldest soccer league,,
can you shave a puppy,,
what does mathematical e stand for,,
who is roman atwood need me,,
meaning of dail,,
who sings bang the gong get it on,,
when is spiderman day,,
where is fdr park,,
zachary what number president,,
who shot alpha particles at a thin piece of gold foil and discovered the atom is mostly empty space?,,
how did king francis ii die,,
who was the editor of the liberator,,
what does andrology mean,,
most common cause of phase imbalance,,
when was bobby flay married,,
what station is npr on in tx,,
what works for hot flashes,,
when mae was born,,
when did ansel adams start photography,,
rick saltzman vampire diaries actor,,
how hot lightsaber,,
who did odysseus fight,,
where leonardo was born,,
who played harper on er tv show,,
who was the lovings?,,
who said blood and iron,,
how old is addison riecke,,
what is lulu,,
when is juliet's birthday romeo and juliet,,
what side do you lay on for digestion,,
oldest person ever to become president,,
ancestry of obama,,
when were newton's laws of motion created,,
what species make ants go away,,
what is deontay wilder worth,,
what is non weight lo,,
pseudo pocket definition,,
what is tamra judge's net worth,,
what are they testing for before tummy tuck,,
who was eddie eagan,,
what is fishnet clothing for,,
where was mike tyson from,,
what can cause a varicocele,,
what county is new home tx in,,
how old is president obama,,
who wrote the book of daniel and when?,,
how tall is don diamont,,
what's an idiom>,,
how much does h&r block charge for taxes,,
who is fighting against isis,,
who was the drummer in benny goodman small group and big band.,,
how long does a eggs in a cockatial take to lay,,
what is aloof,,
who is winona laduke,,
who died in tlc,,
definition entranced,,
what airport is ena,,
where do they shoot the show the flash,,
who plays randall flagg in the stand,,
abednego meaning,,
who is ben hermes,,
is bayley wwe single,,
what nationality is middle eastern,,
what are the roles and responsibilities of the church,,
who is pancho via,,
vandalism meaning,,
who is bess kalb,,
when was the patent on the cotton gin,,
syncretism meaning,,
what are some symptoms and signs of pregnancy,,
what is ryan mitchell's net worth,,
who is jason hanson,,
ch meaning,,
who is the headmaster in harry potter,,
can a blood test detect pregnancy before urine,,
who sang goodbye to you,,
how to easily clean stove grates,,
which hepatitis is passed by blood,,
how many people are named shayla,,
who played trampus on the virginian,,
definition of crucify,,
how many eggs does a polish lay a week,,
how long until nausea kicks in from being pregnant,,
who is the mayor of london,n,
impact of the indian act on first nations,,
who is eddie cibrian married to,,
who is nadal,,
what is polyhedra,,
jennette mccurdy age,,
when is your ovulation,,
who created the piano,,
who is darrell wallace,,
how much is joe francis worth,,
what to expect when you told to see a neurologist,,
how many seasons has aaron rodgers played,,
who is paul walker,,
who played queen's assistants in housefull,,
military definition of mil,,
what is mbe certified,,
when was starboy by the weekend released,,
who was jack johnson quizlet,,
how old is heidi gardner,,
what is the result of an error in mitosis,,
bull hurley actor,,
therapists who accept medicare,,
what is a peacock bass,,
pic definition,,
when was neon discovered?,,
who shot john f. kennedy,,
franks actor on everybody loves raymond,,
when was the american legion auxiliary formed,,
who is the actress on the away team in star trek operation annihilate,,
what percentage of separations end in divorce,,
which stage is the phallic stage,,
what is rick ross,,
fsh how much before pregnancy,,
where was david clarke born,,
what is a normal hcg level in pregnancy,,
is gonorrhea contagious after treatment,,
what kind of shorts do explorers wear,,
when did abdul jabbar retire,,
what's the best way to get rid of ants,,
what is the meaning of tweening,,
what president number was john f kennedy,,
confidant character definition,,
who was pelagius,,
joyce real housewives of beverly hills,,
is scarlet a name,,
how old is shahin najafi?,,
where is crabby,,
what was stalemate,,
when did germany work on atomic bomb,,
angela duckworth what is grit,,
what is rplu designation,,
when is bosses,,
address of where james monroe was born,,
youngest person to serve as president of the united states,,
what is the highest scoring hockey game ever,,
what is a hysterectomy procedure,,
who makes vitafusion vitamins,,
where is shell falls in wyo,,
what's the oldest age someone has lived,,
how long is it between periods,,
what's apple voiceover,,
how did gary cooper die,,
is jonathan groff,,
where is washington tx,,
who is procrustes,,
when was the child protection law created,,
what continents do moose live,,
how long is the lunar phase cycle,,
what actor plays hellboy,,
what is a polo,,
who is loverboy,,
president macron how tall,,
is kate hudson pregnant,,
what is the leading cause of death from injury?,,
Somnambulatory definition,,
what is a gable hawthorne,,
temperature drop,,
what can nursing home restrict?,,
how.old is vanna white,,
what kind of dog breed does the deaf people use,,
which us president was also chief justice of the supreme court,,
who is danar tools,,
who are growers?,,
is pid only caused by stds,,
what is prodi,,
why do cats lay on their back,,
who is carl perkins,,
where is fall church,,
what is the puerperium,,
how much does simba weigh,,
how many days after taking penicillin does rash appear,,
what is breastfeeding for the baby,,
phone number for dr. victoria masear,,
tamera meaning,,
who sings borderline,,
what is disability discrimination,,
how much water should i be drinking per day while pregnant,,
what was colombia's original name?,,
what is rubella antibody test,,
how can you tell when a guppy is pregnant,,
what is my ssa retirement age?,,
what did martin luther king do that was important,,
who all died in the shooting,,
when was cosentino's founded?,,
which bank loaned donald trump money,,
what is listless,,
what is a hemtt flr,,
what is johnny's personality in the outsiders,,
in the movie titanic did they actually throw the blue diamond in the water,,
what is the region mk,,
who is vanguard,,
who died in the boston massacre,,
what is uas elements,,
who is russ tamblyn,,
what organs are found in the cavity of frogs,,
where do yetis come from,,
when was the song beautiful dreamer written/,,
different types of defenses in basketball,,
who does lou williams play for,,
what is a silk press,,
what causes spit,,
in humans,n,
what did walmart have to do with tracy morgan's accident,,
if someone is choking on food what to do,,
how did willie hutch died,,
who broke the color barrier in soccer,,
who is george m cohan,,
who is sasha williams,,
pride month is about,,
is steve stone in the hall of fame,,
is a supervisor considered a manager,,
ayizan veve meaning,,
what does an empty corny keg weigh,,
where is mousie kentucky,,
where is bharananganam,,
what does obstetrics mean,,
can you lose weight eating a lot of carbs bodybuilding,,
why did people powder their wigs,,
how old is daniel craig?,,
how old is alicia keys?,,
what causes heavy bleeding during period,,
who played lou ann poovie,,
what happens after radical prostatectomy,,
what is friend zone limerence,,
how soon after a dog bite does,,
what causes newborns to be tongue tied,,
where is albany oregon,,
what is preterm labor and what are the risks,,
do any states ban kratom,,
what can i eat after throwing up,,
how old is kareem jabbar,,
what is anonychia on feet,,
who is james merrills,,
how long can someone go without food and water,,
what is class dojo used for,,
who were the characters in the series prison break,,
define acquitted,,
difference between picket and protest,,
when was the letter in birmingham jail wrote?,,
when can i see my baby move,,
how much to open a renter's insurance,,
when are you supposed to hit puberty,,
who was albert ellis,,
which fish retains the most mercury,,
what year was football invented,,
when was the book i know why the caged bird sings published,,
meaning of aaron the name,,
what did the ADA laws do?,,
who died when they fell off mount hood,,
how old is benjamin orr,,
which was part of the columbian exchange,,
what shelf should i use to bake beans,,
what type of government did simon bolivar push for,,
how old was billy walker,,
how much should i pay for home daycare,,
definition nondisjunction,,
king louis xiv definition,,
what awards has janet jackson won,,
what was miss kitty role in gunsmoke,,
does alcohol cause skin rashes,,
what is pfy,,
what does steve for,,
when do you know you need computer glasses,,
what is exile?,,
what is an internal cache,,
what kind of food to feed a teething puppy,,
incumbency definition,,
why india name given,,
what is what is brandy,,
what does ymca song stand for,,
who is kabuki,,
who is attending billy graham funeral,,
what was woodrow wilson's new freedom,,
studio means what,,
when are where was martin luther king jr born,,
who is ted danson's wife,,
what was one significant accomplishment of president ronald reagan?,,
has leader of isis been confirmed dead,,
harriet greenfield np,,
what teams did jason taylor play for,,
who is james weldon johnson parents names,,
if i have a dependent,n,
what is bill gates worth,,
what is normal heart rate resting,,
how much does select volleyball traveling team cost,,
what nationality is the name louise,,
most admired business person,,
what are casts,,
who was johnny fontaine based on,,
what are centromeres,,
what is the world's most famous painting?,,
who is michael savage?,,
net worth nicholas cage,,
what episode does sasuke leave the village,,
when are vitamins best to take am or pm,,
who started spacex,,
what does positive result for rubella antibody mean,,
cost to repair ceiling after water leak,,
hedjet meaning,,
how many oscars has martin scorsese won?ccccccccccccccccccccccccc,,
how long does pledging last,,
at what gest age can you get a termination of pregnancy,,
how much peroxide to make dog vomit,,
what is the possessive noun for church,,
how many times can you run for president,,
what disease did the aztecs get,,
what is tame,,
how long does it take to normalize sleep cycle,,
what does gangam style mean,,
what was albert einstein's iq stat?,,
when was antigone first performed,,
identity synonym,,
new meaning of finesse,,
what does the name nakayla mean,,
what to do with hot feet at night,,
what year did franz joseph haydn die,,
what is symbolic thread drawing,,
how many k in a meg,,
biggest ant,,
what was martin luther king jr's achievements,,
were is the the cloro purple was filmed,,
who invented the speakers,,
what is the name of the movie with morgan freeman,,
what are rh factor,,
when is fertilization,,
what is poetic justice,,
what does sartorial mean,,
average diamond ring cost stats,,
where is randall's island located,,
did oliver cromwell and thomas cromwell were they related,,
are bacon and eggs bad for diet,,
when was sharecropping most popular,,
can you have a late period after ovulating without being pregnant,,
who is william tallman,,
causes of labia bleeding,,
are marsupials mammals,,
what is bombshell mean,,
is a shire horse bigger than a clydesdale,,
when do wild rabbits leave the nest,,
when did the war at waterloo begin,,
where was john the gospel writer born,,
how old do you have to be to fly on allegiant alone,,
l what is donald trump's wife's name,,
inflation causes many problems,,
when the rain came song,,
what is sent in wedding invitation,,
where is silkeborg,,
what racist things has trump said,,
who is al jarreau,,
when was alfred,m,
who wrote the book the good fight mn senator,,
who is stephen miller?,,
who is jessica simpson married to,,
what part of the cell divides in cytokinesis,,
who established hardyville,,
what is e coli in urine culture,,
tabitha tv show cast,,
how many unique words in cat in the hat,,
who created the balfour education act 1902,,
is michael brantley the top left fielder,,
who is jason?,,
genetic differences between men and women,,
was stalin an anti-semite,,
how long does it take for sedation to wear off on horses,,
what is subdued,,
how does america measure unem,,
what do gemini rule,,
are almonds good for kidneys,,
which mp3 player should i buy,,
how much did the nra give,,
what is vaginal atrophy,,
what parts of the body does rheumatoid arthritis affect,,
what year was the first book found?,,
what is calsilica?,,
what is usain bolt,,
how many hours does a cna work,,
who is inspector clouseau,,
how many comedies did shakespeare write,,
what score did OBama get on the LSAT?,,
what is coping cats,,
is guardian training,,
age graded running table univ,,
what age do you stop school,,
how many years did emmitt smith play football,,
what temperature and how long do you cook sausage in the oven,,
what are the tubules that produce sperm,,
what is the civilian working-age population,,
what is milk stork,,
who is the editor of forbes magazine,,
forehead kiss meaning,,
who is ben hur's nemesis,,
radical republicans did what to president johnson,,
most popular endangered animals,,
what did john maynard keynes think would resolve the great depression,,
when did fidel die,,
what is cervix cancer,,
irs definition of gross wages,,
where is parker colorado,,
who is the president in the us,,
how much does yokozuna weigh,,
what is the uncertainty of the position of the bacterium?,,
when will doctor prescribe clomid,,
is ghost in got alive,,
how many portraits did johannes gutenberg paint,,
where was movie stardust filmed,,
bona fides definition,,
which justice is over the fifth circuit,,
what time is the best time to start potty training?,,
who sang united we stand divided we fall song,,
when was the Halmark movie Love under the stars produced,,
how much daily physical activity do experts recommend for someone trying to lose weight,,
how did ww1 contribute to the great migration,,
is emily an english name,,
quiter population,,
how many regions are in ga,,
why did obama get the nobel peace prize,,
average income for cosmetologist,,
which shark loves fresh water,,
where does hair grow the fastest,,
how many cells are produced during meiosis?,,
cast of while you were sleeping,,
who is nicholas cruz?,,
what is the womb,,
what the cost to maintain an in ground pool monthly,,
who did kevin mcnally play?,,
how long can you leave puppy in crate,,
how many stripes are on the cat in the hat hat,,
what prodigy said about obama,,
what is the contribution of housing authorities,,
who is ny governor now,,
what is the importance of the odyssey and the iliad,,
act definition noun,,
time sleep eat wait,,
who sings break.every chain,,
what is abraham lincoln's date of birth,,
jail time for vehicle theft,,
what are the oldest dog breeds in the world,,
who wrote soulshine,,
number of people in usa,,
what are fraternal twins,,
where did uss constitution vs hms guerriere happen,,
who is marialyn barnard texas court of appeals,,
who is clarice feldman,,
who is larry the leprechaun,,
is stealing an illness,,
english meaning of les miserables,,
what is reversed sentence construction,,
what did dr. charles hufnagel do?,,
uncle's name in it's a wonderful life,,
how do i start a dog walking business,,
pollination occurs when pollen lands on,,
what kind of fish are in the illinois river,,
how does the cheetah run so fast (kids),,
how long after implantaions bleedint to test,,
where was jensen ackles born,,
what was matt lauer accused of,,
when is it okay to workout after pregnancy,,
what causes composition of blood,,
what does forbes mean,,
define bane,,
what does maya angelou's poem alone mean,,
who was eli whitney,,
where is simi valley california,,
who was cab calloway married to,,
when is st. nicholas day,,
define humiliate,,
length of average necklace,,
what happened to steve edwards,,
where is the ravenwood smith,,
where the steel come from,,
why was wilson considered a progressive,,
what does having a lot of heart means,,
what is a good way to remove arm hair,,
what is the origin of the last name chapman?,,
seafarer meaning,,
what type of cat is buttercup from the hunger games,,
vassals definition,,
what is a purple people eater,,
centromere definition biology,,
what was dr. martin luther king,,
who discovered the rainbow theory,,
is the human centipede medically accurate,,
can a civilian become a warrant officer,,
what is a shalimar,,
rumpkin definition,,
when did the movie the sandlot take place,,
who is george winston,,
how much should a mature pug weigh,,
what is aham,,
what does the hcg level need to be in a pregancy test,,
what medical classification are hearing aids,,
what was jimi hendrix real name,,
warrior cats thunderclan,,
which album does shake it off belong to,,
who was the desert rat,,
what is the full name of george w. busch,,
is it safe to eat cinnamon when your pregnant?,,
haw long doses french bulldog be in heat,,
why foot cramps at night,,
how long do you roast almonds in the oven,,
how many chromosomes are there at the end of meiosis,,
who wrote close your eyes,,
is it ok to wear glasses while healing from cataract surgery,,
who made the song paradise,,
critical condition meaning,,
is apu regionally accredited,,
who starred in original death wish,,
what is the uncertainty of the position of the bacterium,,
how much is joe biden worth,,
who is stephen king,,
what's the world record of pull ups,,
todd schnitt net worth,,
what is the hebrew word for wisdom,,
which economic problem did many latin american nations face in the years following world war ii?,,
who was joseph addabbo,,
can you say happy birthday?,,
which emperor was numa pompilius,,
what two seasons do the equinoxes occur,,
what was the harlow monkey experiment,,
quinine effects on the body,,
how many goals has wayne rooney scored,,
angella lapukeni,,
is donald trump illuminati,,
where is kailash satyarthi from,,
what is adze,,
which composer did the wedding march,,
how to draw a fierce full body wolf,,
how old laura wright,,
when was the actress joyce dewitt born,,
who is andy murray's coach,,
leet definition,,
how long swaddle,,
who is ezio,,
side effects of drontal plus for dogs,,
how old is zach herron,,
who recorded the song slow dancing,,
what causes vaginal bleeding during sex,,
what is nst medical term,,
how long after ovulation pregnant,,
who wrote the miraculous books,,
who was vice president after nixon resigned,,
where is berkeley,,
how long until bees are gone from a hive removed,,
what is the temple of neptune made out of,,
what happens to your body when you lower calcium,,
when was first telephone call,,
why did aaron burr hate hamilton,,
is mark fuhrman married?,,
what was lebensraum?,,
at what stage of pregnancy do i take glucose test,,
who is jerome in gotham,,
did pete sampras win a grand slam,,
fibrocystic breast disease causes,,
what is a good rule of thumb?,,
hormonal normality,,
who who is justin verlander married to,,
was richard dawson ever married,,
is a wedding ring worn on left or right,,
effects of being pregnant,,
what colors are dragons,,
what is the normal range for hemoglobin in human body,,
how many milligrams of calcium is safe to take a day,,
what does the engine casting number mean,,
what was martin luther king jr speech called,,
how long was the battle of passchendaele timeline,,
teletubbies feet,,
how long is a president's term in office,,
how long does a leopard gecko live on average,,
what is roald amundsen famous for,,
