who was known as the heretic king,,
who plays the main character in night at the museum,,
what is surrogate,,
how popular is the name katie,,
how much sleep in one day does a baby need,,
what type of books does karen hesse write?,,
can you drink coffee before a mammogram,,
what college did bill gates go to,,
who was jacqueline kennedy's social secretary,,
abbot definition,,
concentra how old is a cat in one year.,,
when was stalins response speech,,
who is jennifer garner,,
how many weeks can a puppy get spayed,,
who influenced pablo picasso,,
what year did james still graduate,,
actress who born at litrhuania,,
what cow?,,
susan sarandon cup size,,
who is mark zuckerman,,
who played jake ryan,,
who wrote song yesterday when i was young,,
when was actor karthik born,,
which prep school did president kennedy attend,,
how much did freddie mercury weigh,,
when was mike tyson's last fight,,
what instruments did john denver play,,
who is victoria lomba,,
how old should your puppy be to get a rabies shot,,
what is produced during mitosis,,
why did van halen break up,,
who was richard the lionhearted,,
who is king philip of spain,,
which microscope were cells first observed,,
who was herodotus,,
how many children does alicia keys have,,
what team did bill russell coach,,
what has obama really done for america,,
where is alexander ,m,
manual define,,
bruce willis die hard movies,,
who is steve brown,m,
where is kobenhavn,,
did demi moore have plastic surgery,,
age of jennifer lopez pregnant,,
when did lou reed die,,
what happened in cabo shooting,,
distraction medical definition,,
who is richard henry less,,
in what year is crepusculario published?,,
how old is dolly p,,
what kind of food did michael jackson like,,
dr who,f,
who was bruce lee by jim gigliotti,,
where did vincent curve go to school,,
how did the progressive party get the name,n,
how to insert pin iv bag,,
what instrument did benjamin franklin invent?,,
who was chief joseph,,
has aly raisman boyfriend,,
what is coffin birth,,
how old is joe scarborough,,
what age are puppies ready to be sold,,
where was giles corey born,,
what is early childhood studies,,
how old is rex in xenoblade,,
what are sojourners,,
which singer was named ambassador of youth and culture for the barbados>,,
what does mi stand for in accounting,,
what does the name luna stand for,,
when is jennifer hudson's birthday?,,
what is abby lee ultimate dance,,
when will todd sharp coach be back on lifetime,,
what is the year of birth of louis pasteur,,
filly definition,,
what experiment did james chadwick use,,
how old is tom selleck,,
what does otc stand for stripper,,
what was the date jack ruby shot lee harvey oswald?,,
who is petunia pig?,,
what is halsey?,,
what part of a plant contains the stigma,n,
when did jack kevorkian die,,
christopher hemsworth,,
who plays lauren in the gifted,,
how old is alyson stoner,,
what day did terri schiavo die,,
where was katy perry born,,
who wrote i'm going down,,
who was pablo escobar,,
how old are the members of fifth harmony,,
where was daniel radcliffe born,,
when did mae jemison graduate,,
who is the nine-tailed fox?,,
where is martin luther king jr's place,,
when was master luther king junior was born,,
where was linda lingle born,,
in flowers,n,
what is the highest life expectancy,,
what is march for history month,,
what is hemianopsia,,
what team derrick rose went too,,
when was a netball ball invented,,
price of a princess diana doll,,
how long did it take charles lindbergh to fly across the atlantic ocean,,
what is chalk paint,,
how old is elle mckinnon,,
who was robert fulton,,
how rich is bill gates facts,,
how old is mary mcdonough,,
who was booker washington,,
what is a feature of grey matter,,
who is senator scalise,,
where did the fight ali fight larry holmes,,
hey how much does a hippo weigh.,,
who was king louis xvi?,,
what temp do you cook pork to,,
when was grant made lieutenant general,,
what caused marilyn monroe's death?,,
what are drupes,,
do you have to pay to get papers notarized?,,
how tall is robert wadlow?,,
what happens to the chromosomes number as a result of meiosis,,
what does scarring on the lungs mean,,
who are the lotus-eaters,,
what are intelligence tests,,
what disease does michael phelps have,,
what is the average age of a child to start potty train?,,
who is alexander von humboldt,,
how much does a cow eat per day in kg?,,
where was john cage born in,,
where did samuel adams live,,
what colony did joseph hewes represent?,,
the last scout cast,,
when does oj simpson get released from jail,,
what food gives you calcium,,
what did the nineteenth amendment to the constitution do?,,
banana goldfinger,,
what day did louis xvi of france died,,
what state was rockefeller oil known in,,
who is deuce gorgon,,
who was silence dogood,,
how tall does a child have to be in a booster,,
how many points did michael jordan score in the flu game,,
what did st patrick drive out of ireland,,
what is wwe diva maryse real name,,
how did kennedy die,,
what was nathan chen's score for the short program,,
what does pipe dream mean,,
where was hitler born and raised,,
what is lindsey vonn net worth,,
what's george name,,
at how many weeks in pregnancy should you not travel,,
how long to get colostrum in calf,,
scott newman actor,,
what is a deuce coupe,,
how much is terry hogan worth?,,
when is oprah's birthday,,
who the richest,,
when is the cutoff date for albums to be eligible for grammy award nomination?,,
how many days did king spend in jail for protesting in birmingham,,
what is the egfr,,
most decorated speed skater,,
where is guthrie hospital located in new york,,
in what year had youtube started,,
how long do bunnies sleep,,
is blake lively pregnant,,
when did mathew brady die,,
what is body soul & spirit,,
soof meaning,,
what is hazlitt,,
who plays princess tiana,,
what is the record for sneezing in a row,,
how long until you can start showing symptoms of pregnancy,,
define manly,,
who is mighty mike,,
where was paul mccartney born,,
who was the original jack abbott?,,
the age of the oldest person in the world,,
sarah how many doors,,
sick of a palsy biblical definition,,
what is hemophilia most found in,,
where did frank lloyd wright live in wi,,
who played smokey floyd,,
what is john adams background?,,
who is margaret peterson haddix,,
who is chris griffin,,
singer, tony fontaine,m
how old is heather locklear now,,
how long does heat last for dogs,,
how tall is mark thomas,,
did bert convy die of aids?,,
siree definition,,
where in the world is george washington carver,,
when was the first records of the usa,,
who is voldemort,,
what is kinsey most known for,,
who was thomas edison's parents,,
was hera syndulla in clone wars?,,
yacht beatrix,,
what body fat percentage is healthy,,
what movies has hailee steinfeld been in,,
who was trotsky?,,
westboro mass demographics,,
when was william h billy born,,
when did walt whitman live,,
what did audrey hepburn win oscar for?,,
when a chromosome pair fails to separate correctly in meiotic division,n,
where are the dis,,
what caused steve holcomb's death,,
was albert einstein married,,
who plays mowgli in the new jungle book,,
what did mark cuban pay for the mavericks,,
how old is the actor who plays wolverine,,
in what year did harriet tubman escape from slavery?,,
what is enhance,,
is pete hegseth married,,
what is one sheep called,,
what is taylor lautner ethnicity,,
what does gbs mean,,
how many eggs did cool hand luke,,
what retailer sells victoria beckham?,,
what year meap leaf rag began,,
before how long should i go for passport renewal,,
meaning of joseph,,
what is a tcl script used for,,
who was gabelo,,
what does the mask symbolize in lord of the flies,,
when was the painting starry night made,,
what kind of books does shakespeare write,,
durka durka meaning,,
what empire did alexander conquer? who was its king when it fell,,
what state was selena quintanilla born,,
where was usher born,,
which theory of personality focuses on the influence of the unconscious mind,,
who killed abraham lincoln and why,,
what is tom brady's career yards per attempt,,
how did angelo dundee die,,
oom temperature for baby,,
what is michael blake nationality?,,
how much is chris hemsworth net worth,,
who is seth rogen,,
when did chuck connors die,,
what happened to donatella versace's face,,
how old is sigourney weaver,,
where is thomas rhett from,,
how much pee does an adult pee in one day,,
sncc definition,,
what purses did princess diana use,,
what does susan b anthony die,,
did ken norton die,,
when did the globe theatre have performances,,
amber rose what bra brands,,
who is reese witherspoon married to now,,
when is usain bolts birth,,
who was marco polo book,,
where did dr.charles r drew grow up,,
who is jill hennessy,,
how old is moana in the movie,,
who is marjorie holt,,
who was baron von steuben,,
how to get big thighs and hips,,
who is mr. gorsky,,
where do the chicago fire play,,
how many days early will insurance fill my suboxone,,
are hormones import,,
who says the quote if personality in an unbroken series,,
who is langston hughes?,,
how old is james arness,,
where is the aetherium forge,,
what is tony hawk's stan lee net worth?,,
age of patti lupone,,
what war happened while washington was president,,
who faked their own death,,
what kind of hair does lindsey vonn have,,
what person is famous for morphing tessellations,,
who sings i still get jealous,,
albert runcorn actor,,
who was teflon don,,
what years was dwight d eisenhower the president of the united states,,
who is ertugrul,,
will ferrell harry carey acting,,
how old is janice dickinson,,
rsm meaning home care,,
when did martin luther king jr timeline,,
voluntary tics,,
how to tall was abraham lincoln,,
what were thomas jefferson significant contributions to the united states?,,
cristiano ronaldo uniform number,,
how many years does nelson mandela spent in prison,,
what does nelson mandela mean african,,
who is holly willoughby?,,
how many months when baby reaches,,
who played tom riddle in harry potter,,
where does mallory pugh play,,
can anyone get tourettes,,
who is barbara carr,,
kehlani ethnicity,,
what album is solsbury hill on,,
who was lydia,,
who screening recommendations,,
how old is rick warren,,
who is bane,,
what is the purpose of dna replication,,
how old was james buchanan when took office,,
when was pere lachaise cemetery built,,
what is a sport?,,
robia rashid,,
where is dovizioso born,,
who was the voice of mr ed the horse,,
is no child of mine a true movie 1993,,
what does push to talk mean,,
mha stands for what,,
can a month old sit up?,,
what group was carlos santana in,,
how tall is lisa kudrow,,
how to start baby on whole.milk,,
what medal did cesar chavez get,,
how many die of heart attacks,,
what is michelangelo's death year,,
what does it mean when you bleed before period,,
when was annie born,,
who appointed john quincy to be a minister,,
. what did jan ernst matzeliger invent,,
what shows has kate walsh played in,,
when did andrew fisher leave office,,
define multitasked,,
what's a transducer ultrasound,,
when did obama receives nobel peace prize,,
what age do children go to booster seats,,
when did ariana grande move,,
how long can sperms survive,,
who found the twins romulus and remus,,
what actor did the mark twain on stage alone,,
where does shane dawson live,,
bug bites in child,,
what nationality is steve perry,,
which composer is regarded as one of the world's greatest composers of all time?,,
when did everybody by logic come out,,
what state was joseph stalin in,,
what was charles dickens pseudonym,,
who sings tomorrow from annie,,
what age should a child be able to take their own bath,,
what year did the statue of liberty become a monument,,
david ortiz last number,,
what instrument did stephen foster play,,
is hines ward in the hall of fame,,
how many hours in ohio before lunch break?,,
who is chester arthur,,
how long do dogs bleed,,
who plays lou fleming on heartland,,
how long can a parked car be in front of your house?,,
where did president george washington live in as president,,
when was helen keller born and died,,
who was prince phillip,,
what was neil degrasse tyson known for,,
what oils do i use to stretch my ears,,
what kind of car did richard hammond crash,,
what makeup does kendall kardashian wear,,
how many children did John f kennedy have?,,
what house was ginny weasley in,,
how much does a lab cost per month,,
what is the language of divine comedy,,
when did nixon get elected as president,,
mimic definition,,
was amelia earhart a feminist,,
how tall is barbra streisand? weight,,
alice what does it mean,,
when was old time rock and roll created,,
what crimes did king louis xvi commit,,
what statement did trump make about abraham lincoln,,
where was davy crockett from?,,
what did robin gibbs die of,,
did bobby jones win the grand slam,,
what is jamie foxx is real name,,
when was maus published?,,
what music did steve jobs listen to?,,
what did roosevelt's new deal do,,
what does the word ina,,
who is philip pullman,,
when did gene kelly die,,
when was robert boyle a founder of modern chemistry,,
what is yugo,,
who is bob odenkirk,,
what does the name dylan mean,,
who battled for power after lenin died,,
how old is ralph kiner,,
how old is mia,,
what subject is gilgamesh,,
why does my dog breath heavy,,
waters name meaning,,
how did tombstone get its name,,
definition of a peasant,,
when did selena quintanilla die?,,
who created black butler manga,,
who are the members of new kids on the block?,,
what year and born was frederick douglass born,,
who is bianca lawson,,
define chantry,,
what is crating?,,
is king arthur real or legend?,,
who is the tallest living person in the world?,,
what is nick hagen most famous for,,
which gender is most likely to get cancer,,
how long does abby lee miller have to spend time in jail,,
what are the sunglasses that kenny chesney is wearing in the video the good stuff,,
who is chase davenport off of lab rats,,
what did david houston invent,,
when the baby drops,,
when was amelia earhart go to fly over the atlantic ocean,,
is george soros atheist,,
how long does it take for a butterfly to hatch,,
timothy duffin fax number clarksville tn,,
what date did pizarro capture atahualpa,,
who is kathy lee permanent co host,,
cant definition,,
who led raid on harpers ferry virginia,,
is bootham hyork quaker,,
what is the nutrient in blood that helps mosquitoes develop their eggs,,
who is nick robinson,,
who is brian jones,,
how old is charlize theron?,,
how old is bernard langer,,
youngest american to win a new york critics circle award and first black playwright,,
how did steven holcomb die,,
how tall is colby brock,,
how long was shakespeare married to anne,,
when do babies learn to walk,,
who did darren sproles play for in,,
who is in robert plant's band,,
where bob crane born,,
famous stars who have had prostate cancer,,
how when and where eleanor roosevelt died,,
how much is bindi irwin worth,,
who was senator robert byrd ?,,
what is jamarcus russell net worth,,
who is alphonse in frankenstein,,
who is lara trump,,
when was Miguel Garcia born,,
is kathy griffin currently banned from 'the view'?,,
how old is danny koker,,
what movies was chris pine in,,
how many species of cows are there?,,
what is dmpa,,
what are tactical boots,,
has leah peebles been found,,
youngest phd holder,,
were there giant humans on earth,,
what does very yellow urine mean?,,
how many teams did derrick rose play for,,
who is billy campbell,,
why do cats ears bleed?,,
sexuall gender based violence definition,,
What does the name Alicia mean,,
how tall sarah hyland,,
can you break dogs chasing cars,,
where is mike jones from,,
is charlie sheen sick,,
can melania trump speak english,,
when did nelson davis die,,
when do babies start eating whole foods,,
is the raven a poem or an essay,,
what's the song that kelly clarkson made cried the american idol panel,,
where is magic springs?,,
where was pom klementieff born?abcdefghijk,,
traits vs characteristics definition,,
how stalin die,,
when did aldo leopold die,,
who is prince of wales,,
who is ronald mattson,,
win did george washington die,,
who is mike rogers,,
what year was evil knievel born,,
what does flex play mean in football,,
johnny paycheck age at death,,
who was leo ii,,
what are mice,,
did audrey hepburn have an accent,,
what was one of the purposes of president Lyndon johnsons great society,,
when did gucci mane go to jail,,
what education did martin van buren go to,,
who was hamilton fisk,,
when was the book i am malala published,,
what was john lennon's middle name before it was changed to ono?,,
what language was enya singing in,,
when was touching the house on mango street published,,
how many times is power is used in the new testaments,,
pauley perrette age,,
when were the three godfathers made,,
dentist in jackson,,
what work did pietro perugino made,,
egyptians are what ethnicity,,
how was rosa parks life growing up,,
where was the andy griffith show filmed,,
what is trafficked,,
how to text on att website,,
what age do people start going bald,,
what was the black hawk war,,
who is luke bryan,,
how many siblings does stephen curry have,,
what did harry harlow discover,,
brantford,n,
what is the name of robert fulton's steamship?,,
average prison sentence for bank robbery,,
what age are goosebumps books appropriate,,
what does freeball mean,,
what was oscar wilde arrested for,,
what is a tragic flaw,,
how caitriona balfe got role in outlander,,
who sang the streak?,,
when is dysmenorrhea diagnosed,,
name meaning damian,,
can obama run for president again,,
what type of composer was scarlatti,,
what album is i'll name the dogs on,,
name of kind of dr that looks at spines,,
what shows was mimi kennedy on,,
number and type of cell from mitosis,,
what is motorboating,,
is angus t jones still a seventh day adventist,,
dr. marc theroux fax number,,
who plays doran martell,,
feminine name mae definition,,
what type of pilot was bessie coleman,,
what is theresa,,
who is kiki dee,,
how tall is allison munn,,
who said i have met the enemy and it is us,,
what is a milk bank,,
how did harriet tubman change the world,,
What does the name Lara' mean,,
who was esau married to,,
does is snow in haw,,
who plays negan in walking dead,,
how to help a 2yr old with constipation,,
how old is the golfer phil mickelson,,
when was scream made?,,
how did karen carpenter of the carpenters die,,
when did copernicus live?,,
why do the heels of my feet smell,,
how many eggs do beetles lay,,
when was paul tibbets born,,
how tall was james stewart,,
how tall is jessica chastain,,
who stars in snatched,,
who was the king of ancient rome,,
did prince have children?,,
how much has sebastian janikowski made in the nfl,,
how old is katherine langford,,
richard jenkins worth,,
what was dr seuss's real name,,
wilmer valderrama worth,,
what division is university of arizona basketball,,
who was thomas paine,,
who did tony lupien play for,,
did carol burnett play in annie,,
define emperor hirohito,,
who played dr evil,,
who is daryl fowler,,
how old is lorenzo cain,,
are moths harmful to dogs,,
when did sally ride first go to sp,,
who played evie in descendants,,
what is a synonym for beautiful,,
who was samuel morse subject's parents,,
when was daisy e lampkin born,,
who is king alexander,,
cost of restylane filler for under eye circles,,
name meaning willow,,
what is another name for the yellow river,,
what cancer does boosie have,,
bryan adams childhood,,
did bob kerry run for president,,
who is margaret sanger,,
who wrote glory glory hallelujah,,
what instrument did curtis mayfield play,,
who is patrick fakoya,,
who is freddy king,,
when does fetal movement begin,,
who is danielle cohn,,
how long does it take for prednisone to clear in dogs,,
can i take out two insurance policies on my car,,
who is melissa sandoval,,
petula clark dob?,,
how old is aaliyah,,
who is ariana grande,,
where was astronaut farmer filmed,,
what month history is march,,
ian irish name,,
when was wonder released,,
who is macfarlane,,
how old is russell wes,,
what is the movie of elsa?,,
how rich is usain bolt in jamaica,,
who was fired from greensboro news record paper,,
what are symptoms of lyme's disease,,
michaela cuomo,,
who said if it doesn't fit you must acquit,,
what is turtles real name in the westing game,,
caroline kennedy net worth,,
who played evelyn mulwray in chinatown,,
how long does it take for tendons to heal from a broken foot,,
did roosevelt want to apply american power,,
hey who is sofie dossi,,
who is susan?,,
how many children does jk rowling have,,
aramaic abba definition,,
who is aaliyah d,,
fordham university transfer requirements,,
abraham lincoln's death date,,
who are arnold schwarzenegger's kids,,
is yoohoo healthy,,
in what city was lieutenant hecker born,,
where is the martin luther king located,,
how long before robins eggs hatch,,
was daryl hannah missing a finger,,
what camera does jake paul vlog on,,
who is madame curie,,
linda pastan born,,
when did freddie mercury get sick,,
where was audre lorde born?,,
what is obama's pension,,
who is jack reacher,,
what is lapatinib,,
what war was tammy duckworth in,,
the paddington book,,
what did obama do before becoming president,,
how and when did keith whitley die,,
where is elvis buried,,
where is the rock school of dance,,
how did jessica falkholt die,,
who is lil dicky,,
the brat net worth,,
what nationality is olivia hussey,,
who is palpatine's,,
what is juana,,
what temperature should be with parakeets,,
where is herring caught,,
what is considered plus size,,
how much kelly clarkson weigh,,
what is neocate,,
who was priscilla j owens,,
why is marie curie admirable,,
what movies and television programs was mary fickett in,,
when was ruby bridges born at,,
who was the first to sing i will always love you,,
who is charlotte perkins gilman?,,
how many majors did pete sampras win so far,,
conchita wurst net worth,,
how did singer johnny taylor die,,
where did steve jobs go to school,,
christina applegate age,,
what age did marie die,,
who is aimee mann,,
what are afterpains,,
who is jessica alba,,
nclex number of questions passed,,
why is a baby rh positive,,
who is tessa thompson,,
where is the galapagos,,
who is sarah huckabee?,,
what hallmark movies was meghan markle in,,
meaning of name harry,,
miss brill's fur called,,
what did phillis wheatley write about,,
what school did benjamin go to,,
who plays doc holiday in wyatt earp,,
how did ken hubbs die,,
average age for prostate cancer diagnosis,,
where and when was james k polk death,,
what is the address of the george washington home,,
what is the first robot called,,
what is a lowchen dog,,
is the snake from jungle book evil,,
when can know gender of the baby,,
who did william howe marry,,
definition of cap height,,
what movie did amanda bynes play in,,
when to test fsh for infertility,,
what narcotics do to the body,,
how long to get pap smear test results,,
did bonnie tyler record under a different name?,,
was agrippa king,,
how old is malia obama,,
how tall is jon jones,,
when did governor george wallace die,,
luke evans how tall,,
what is the lung cancer survival rate,,
how to take care of a robins egg,,
how many rings does michael jordan has,,
what is the name of the one eyed monster?,,
who is jesse owens,,
biggest human skeleton ever found,,
marcus lemonis worth,,
who is lauv?,,
what is audrey hepburn's favorite color,,
who is beth lilly,,
how many chromosomes does ancestry dna test for,,
how old is benjamin lasnier,,
has meghan trainor lost weight,,
who was bannon,,
when was john paul getty the third kidnapped,,
who is prince philip,,
how much is amy irving worth,,
what is vine social media,,
can melania trump speak russian,,
what is the first naruto.movie,,
what length necklace should i wear,,
who is the main character in hatchet,,
who is gouverneur morris,,
what was marco polo's education,,
when was hitler elected as german fuhrer,,
meaning of love bite,,
what are gbs,,
who is matisyahu?,,
what should i serve for a bridal shower,,
when is manchester united playing real madrid mission time,,
what does herion look like?,,
was selena quintanilla a songwriter,,
who is matt emily blunt?,,
what origin is the name colette,,
What does the Bible say about us failing,,
wanda sykes worth,,
why did theodora die,,
who was leadbelly huddie,,
how many years did franklin d roosevelt serve as president,,
slang what does goober head mean,,
when was fanny jackson coppin died,,
what is king henry ii known for,,
how big is zakk wylde,,
how tall is steve curry,,
average super balances by age,,
who was abigail johnson,,
who plays megan's wife on walking dead,,
impact mean to,,
who was hera,,
how much does danielle cohn weigh,,
is matt bomer married,,
when was melvin carter elected,,
what is the max for pell,,
what can help me sleep through the night,,
where is alexander hamilton from,,
when does elon musk want to go to mars,,
how tall is cicely tyson,,
commissioner sandra murman,,
who owns elizabeth taylors engagement ring,,
who is ann marie cox,,
when was million dollar arm founded,,
what did carol moseley braun accomplishments,,
what is bim bop,,
how much to rent a room in a house,,
who is engelbert humperdinck married to,,
who is the youngest famous singer today,,
what is the average age to get married,,
what is peter parker's superhuman name,,
how old was thomas edison?,,
who is william kennedy smith related to,,
how old would dean martin be,,
suffrage is the right to,,
what testosterone helps muscle,,
who is bill lipton,,
how much does pauley perrette make on ncis,,
which singer was named ambassador,,
kat von d tattoo price,,
who is to replace claire foy,,
who was known as the king of ragtime,,
what political party did bernie sanders,,
who was chuck norris's ancestor,,
how old was the actress who played rue in the hunger games,,
