meaning of international womens' days,,
at what age should an infant sit up,,
when to use colons examples,,
professor who has phd how do they write their name,,
how long did North Korea's people mourn the death of Kim Il-Sung?,,
who was married to tommy lee and ricky sambora,,
when did neil armstrong step on the moon,,
why is paddington station important,,
who was colonel anthony conk,,
where was james cagney born,,
what is sburb,,
what happens to bob ewell,,
what is martha,,
who is princess diana married too,,
what was pablo picasso's personality,,
what is the cause of death during childbirth,,
when is bill clinton's birthday?,,
did tom hardy play bane,,
who was angelina jolie in changeling switchboard,,
how tall is kim cattrall,,
who has had the most wins at the martinsville speedway,,
is a baby's facial features determined from conception,,
what did troy donahue die of,,
when does kohls open,,
marco polo definition world history,,
what did marjorie joyner invent,,
who played ronald reagan in a movie,,
when was isaac brock born,,
how tall is leann rimes,,
when is the best time to exterminate ants,,
where is little falls,,
what forms a strand of dna,,
what speed of usain bolt run,,
when did john pemberton invented coca-cola,,
lymes disease symptoms humans webmd,,
how old was malala,,
who played linda reagan on blue bloods,,
are apollo and phaedra still married,,
what is the caste of starstruck,,
how many kids does michael jordan has,,
age place birth antonio banderas,,
abram meaning in hebrew,,
who is marcus luttrell,,
when was the first computer co,,
what is the other reason anna garcia died,,
who is bo jackson,,
who was friedrich engels answers,,
what disorder did mozart have,,
did mackenzie phillips slept with her father,,
who founded read it,,
cast for the sparrow,,
who is obama,,
who was gentry,,
topher grace net worth,,
what is sass creative bloq,,
how much is worth nicki minaj,,
is travels with charley an autobiography,,
highest ranking african american in the us navy,,
when did brave out,,
was alfred jodl guilty of war crimes?,,
what was unique about walt whitman's poetry,,
when did malcolm x die?,,
who is the cookie monster,,
how old is carl bernstein,,
where is john f kennedy junior buried,,
what are cubism paintings,,
who is bill's bob?,,
who is jocelyn elders,,
caring is creepy,,
who is jon stark,,
the consumption of how many extra calories is equal to one pound?,,
fief definition world history,,
which branch of the armed services did john f kennedy serve,,
noro symptoms,,
how much is martin shkreli worth,,
is jewel divorced,,
when i am young i am tall riddle,,
do seizures mess with your hormones?,,
where is tim mcgraw from,,
who is ingo rademacher,,
what is conway twitty's real name,,
meaning of blossoming,,
usc basketball schedule,,
when did humphrey was elected vice president of the united states,,
what season is scandal,,
who was born on 15 April,,
what is the puerperium period,,
why was cesar millan under investigation,,
what temp does pork roast need to cook to,,
what movies does dove cameron play in,,
where was abraham lincoln born and raised,,
where is jarvis?,,
when was frederick born,,
how old is keke palmer,,
definition legal candidate quotas,,
where did robin williams grow up,,
how is back pay for disability determined,,
how jesus is risen in 3rd day from friday to sunday,,
what is born in bristol,,
when did john steinbeck's the pearl take place,,
who plays double g in-game shakers,,
when did piaget begin studying children,,
calorie needs of teenagers,,
who should have played bella swan,,
what is star food,,
what were athena's symbols,,
who was the voice of cinderella,,
what size does a child have to be to move to a booster seat,,
vintage native american squash blossom necklace,,
what is gamma beta phi society,,
who is john distefano,,
what is a evangelist preacher,,
is an ira distribution a cash payment,,
who old is john oliver,,
how old is thomas brodie,,
what sports do shaun white play,,
what tv show is erin moran in,,
who is ted on cheers,,
where is fort ashby road in wv,,
what is katie couric d,,
how long to cook a 3 pound pork roast,,
how much money does a vet make a year,,
when was mrs. potato head music video released,,
how tall is kate middleton height and weight,,
when jane addams born,,
what are dog pokemons names,,
what was george h. w. bush's religion,,
how tall is thalia,,
who was known to make the piano famous,,
how many times did telemachus try to string the bow?,,
barbra streisand net worth net worth,,
who is pete davidson,,
young jeezy's net worth,,
how do i get my 3 1/2 year old to poop in the toilet,,
average bust size proportionate to height,,
what name did bob hope box under,,
what position does lebron play,,
did i meten im in lov with u lyrics decendents,,
what time are the oscars announced,,
what are human rights? human rights awareness,,
what nationality is melania trump,,
who is doctor seuss,,
when was george washington was born,,
what is vanessa williams ethnicity,,
what does a squirrel make their nest with,,
is morrow a jewish name,,
when did the great depression end for ub,,
why did james mcavoy divorce,,
how many calories burned active day,,
what isis,,
how long does it take a culture strep test to come back,,
tell me how to change your name,,
what age did hank williams died,,
what age did wilma die,,
who is credited with first observing cells?,,
what movement is malcolm x in,,
iq scores are measured with a test designed so that the mean is,,
when is it officially your birthday,,
hillary clinton shattered,,
where was elvis born?,,
when was galileo convicted heresy,,
who did wayne gretzky score most against,,
when was hugo montenegro born,,
what are the names of alexander graham bell children,,
who invented a mouse and when,,
which actor played inspector clouseau? alan arkin,,
how old is shane mc,,
what is a gonad?,,
who was the austrian monk who established the first laws and principles of heredity,,
what's the forecast in celsius,,
when did hitler come to power germany,,
what flight school did bessie coleman attend,,
who invented the first mechanical computer,,
where was george washington from,,
who is king charlemagne,,
dogs pee pee prednisone,,
what is the elmer story,,
what year did johnny & june carter cash get married,,
how tall was bill clinton,,
when can you wean puppies,,
what was winston churchills?,,
who is james arthur,,
has jk rowling won any awards,,
who sings it's just a little crush,,
when did john lennon get shot,,
is caroline kennedy divorced,,
who did charles barkley play for,,
who is whit bissell,,
why is galileo referred to as the first modern scientist,,
who is professor faber,,
who is suzanne crough,,
what company did bill gates co found,,
when is president john adams birthday,,
when did ben franklin create electricity,,
is kim il sung still president of korea,,
what nickname was president roosevelt given,,
who is the crocodile rocker,,
when was saint dymphna born,,
how long has it been since diane princess died,,
when is marcus vipsanius born,,
what does the ceo stand for meg whitman,,
who is meek mill,,
who was prince influenced by,,
what day did the titanic leave,,
who is edward teach,,
who is joan morgan austin mn,,
what is engelbert humperdinck's real name,,
who wrote the summoner series,,
how long is a cats gestational period,,
who is phoebe price movies,,
when was liza koshy born? and where?,,
princess diana was still alive when car crashed,,
how did george washington die and what date,,
what team plays cozart,,
what does ey,,
who is st elizabeth ann seton,,
what is uiu/ml,,
what is the claim of the martin luther king speech,,
who was billy jack,,
what is the name of the little piece of skin under your lip connected to your gums,,
what is alexander graham bell's birthday,,
what did rosa parks parents do,,
where is count dracula's castle located,,
what is bear payne's middle name,,
who is seth barnes,,
was bonnie parker married,,
the story of hamilton,,
how old was sally field on the flying nun,,
how many books did mary downing hahn write,,
how to be in a healthy and happy relationship,,
where was madonna born?,,
address for melody oeth, in,f
what year did taylor swift's first album come out,,
when did john mauchly die,,
who is the actress of felicity penelope in criminal minds,,
where was the first mosque built in the usa?,,
what did President Eisenhower do to promote civil rights,,
who is eileen davidson's character on days of our lives,,
how old is sheree paolello,,
is janee harteau native american,,
what civil rights unrest was maya angelou involved in,,
how many seasons of shin chan,,
how long was judith resnik on the challenger,,
why did the kkk drop,,
who was born in 1738,,
what is style con,,
what economy does john maynard keynes support?,,
what hospital did joan rivers die in?,,
what does pimple on chin mean,,
what was john adams most known for,,
how many nfl super bowl rings does tom brady,,
who sung half & half theme song,,
in venezuela simon bolivar was known as what,,
who is fkj,,
what album is rihanna work from,,
who is currently married to rebecca romane,,
what is kevin spacey doing now,,
what is the prim,,
who sang the song stay with me,,
is angelina jolie dead,,
lyrics like a lovely melody that everyone can sing,,
what is winston churchill military,,
what are some athletics in germany,,
how long do labs grow,,
cast of the real housewives of new york,,
what was roald dahl's adult life like,,
can you have sex with clothes on,,
what is yayo the drummer birth name,,
what does aja mean in hindu,,
what states have moose?,,
definition gross wages,,
how much does a professional athlete get paid,,
how many songs do iggy azalea,,
romantic period violin music,,
what age does baby start to try to dress self,,
when did robert morris get admitted to the ma bar,,
when was robert de la salle born,,
what superbowl is in 2016,,
who is dolly parton,,
when did captain phil harris die,,
what is shakespeare known as,,
minimum calories daily,,
who is rhonda rousey married to,,
when a baby is laying breech lich,,
who is hector elizondo,,
who voices jake jr,,
name meaning for levi,,
who is william kamkwamba?,,
when did johnson dismiss stanton,,
how much did lebron james donate,,
lost planet 2 how to be diffrent charters,,
what is the name of famous painting,,
how much does donnie wahlberg make,,
how did harry carey die,,
who was elizabeth blackwell?''''''''''''',,
are digital prostate exams recommended,,
who is annie pearl avery?,,
who is jonas a clark,,
who was mary jackson,,
who is joseph plunkett,,
what is the real name for snow in summer,,
when does baby's heartbeat,,
when did maya angelou die,,
what does.the name vivienne mean,,
what is sean astin's net worth,,
what year was president trump born,,
who has hillary clinton killed,,
l.a. population,,
who is scott borchetta,,
jews live in germany now,,
how old are is master chief?,,
what team does lebron james jr play for,,
who is margaret fuller,,
how did malcolm x change people lives,,
what is harriet tubmans mi,,
how old is eliza taylor,,
who is grande communication,,
ribbons definition,,
when did haydn die,,
meaning name of ellie,,
did dale earnhardt die immediately,,
most famous post impressionist paintings,,
who was evita peron?,,
naia definition,,
when to use ellipses correctly,,
what are summer months in australia in usa,,
volume and surface area of a sphere archimedes,,
what can littering cause,,
where was julius caesar killed in rome,,
why did george c scott refused the oscar,,
what university did lebron james donate to,,
where did william wegman live,,
who is the comedian on ellen today,,
weight when a calf is born,,
what is britney spears worth,,
who is dorothy want,,
is there a device that i can hook up?,,
who are gwyneth paltrow's parents,,
voice jungle,,
how old is adam rippon,,
what date did king george iii,,
who played grace on will and grace,,
how old is jordi el nino polla,,
who sang don't let me down,,
who did julia roberts marry,,
was john lennon considered legally blind,,
who does the progressive commercials,,
most famous photograph of che guevara,,
who is sophie lasry,,
why princess diana was killed,,
what village was abdul rahman from,,
where is billy bob thornton from,,
who is joshua cooper ramos,,
when did dave thomas die,,
amg rap name meaning,,
who is the world heavyweight champion,,
when was johnny carson born,,
is popping your ears bad,,
did macbeth become king of scotland,,
what were robert hooke's accomplishments,,
meaning of the name hannah in islam,,
who was rasputin,,
how much do you get paid for jury duty,,
who is harry kane?,,
who is edward bloom in big fish,,
where is california,n,
who played barbara gordon,,
is an led nightlight safer,,
how to tell a coworker you appreciate them,,
dithering definition,,
hebrew name milkah meaning,,
what political party did bernie sanders run,,
where is brenda az,,
who is the new han solo actor,,
who is lily from at t commercial,,
is rachael ray getting divorce,,
who really killed jonbenet,,
when can a dog get a parvo shot,,
what is the microsoft co,,
average calories burned per day,,
how many children does mark wahlberg have,,
who is keith olbermann,,
who is the simpson actress who died,,
rh factor definition,,
where was pom klementieff born?hhhhhh,,
when did george martin die,,
how much is stephen king's net worth?,,
what is a crook in music,,
how many babies do killer whales have,,
when did amelia break altitude record,,
who is ellen hopkins,,
what is blossom the tv show,,
where is richard dutrow,,
cost of microabrasion for teeth,,
where is james c neill from,,
when can i take a puppy for walk,,
what date id franz ferdinand killed,,
who is elizabeth macdonough,,
when did airbnb start,,
what the name off the war when the atomic bomb was dropped on japan,,
how old is george clooney,,
how much is anna kournikova worth,,
what are the stages for cancer of the pancreas,,
who played willy loman in death of a salesman,,
when was shubham banerjee born,,
what side do you wear a hawaiian flower,,
where was jane austen buried,,
the world doesn't owe you anything quote,,
where does kirsten dunst live,,
what cap will vlad guerrero wear in the hall of fame,,
who is the actress who plays on game of thrones?,,
when did newton discover theory of light and color,,
Pelvic inflammatory disease (PID) is an infection that is often caused by a sexually transmitted disease.,,
who wrote the earliest works of greek literature,,
what sport did bill russell play,,
who is teddi of the real housewives of beverly hills,,
what is the council of vocations,,
who is erik erikson,,
when was mark morris born,,
what are the booster seat laws,,
what was andrew jackson most known for in history,,
how was harriet involved in the combahee river raid during the civil war? what happened?,,
preston burke real name,,
who is dark vader?,,
how tall is actor henry simmons,,
how old is sofie dossi now,,
which batman game is catwoman,,
who is aubrey plaza,,
marine who saved howard hughes,,
what awards have whoopi goldberg won?,,
what is the max amount for a pell grant,,
why was anne frank caught,,
age of shepard smith,,
who sells joe boxer underwear,,
who is meghan markle,,
when did sally ride first go into,,
causes excessive sweating,,
what happens if you eat food someone coughed in,,
what is tina marie real name,,
name lizette means,,
how long does it take for sperm to.reach the egg,,
fastest rap song ever,,
where did franklin d roosevelt live as a kid,,
annebelle sanchez wife,,
how old is mark knaub hershey pa,,
was mansa musa a king or emperor,,
lucy's last birthday,,
what is donald trump's car?,,
what occurs during cytokinesis of a cell cycle,,
how to get menstrual cycle to start,,
can life estate deed be changed,,
how do i figure my normal bmi,,
who is gloria borger,,
who is jimmie vaughan,,
does all alzheimer patient always forget who everyone is ?,,
pelvis types,,
what is oprah wi,,
how long was charles manson sentenced for,,
what happens when a poodle poops diarrhea,,
what year did jefferson die,,
what is impression stamp,,
how old is gustaf skarsgard,,
what is a litman test,,
what is oprah winfrey's net wo,,
what inspired lillian wald to be a nurse,,
who does nene leakes hair,,
who is brent spiner,,
how did caleb brately die,,
how old is mark harmon actor?,,
who was pepin the short,,
is tatyana ali married,,
when does duncan die in macbeth,,
what is a genotype?,,
is peter falk actor still living,,
the meaning of name ellie,,
what is mulan princess personality type,,
who was richard henry pratt,,
bandaged punisher,,
what did hernan cortes die of,,
how did thomas edison invention of a light bulb affect industry,,
what tests are done for blood in urine,,
can you still have your period if your pregnant,,
who are the jacobites,,
who is armie hammer,,
what prison was nelson mandela kept in,,
is pid always caused by sti,,
how many legs on a crabb,,
did amelia earhart fly alone,,
who played aunt bea,,
what was charles bronson's nationality,,
what team did nikola jokic get drafted to,,
goober slang definition,,
how is alexander the great died,,
what is helen keller's favorite color,,
define preoccupy,,
what scale is a barbie doll house,,
what does sonic blast do to people,,
what the age of a teenager to stay at home by them self,,
who is sheri rose shepherd?,,
where is your l1 in your spine,,
physical health effects of stress,,
ayanna williams age,,
who is shah rukh khan,,
who was william hull,,
what is injected for veins,,
what does dissembling mean,,
how much does a yoga instructor make a year,,
pinworms symptoms,,
what is the meaning of resurrect,,
what is a decken,,
sia meaning in hindi,,
what year frederick douglass die,,
how many years has suge knight been in jail,,
where was allen ginsberg born,,
how old is kyla pratt,,
when is cotton harvested in oklahoma,,
what are the fundamental units of inheritance?,,
causes of watery blood,,
who was lorraine hansberry's g,,
causes of bv,,
who is sunset shimmer,,
facts about elvis presley death fake,,
denise name meaning,,
define administratrix,,
define disposition in law,,
when does bleeding stop after menopause,,
what species of sharks give birth to live young,,
when was Leonard Cheshire born,,
how long does it take for a beef cow udder to dry up after weaning,,
kazoo definition,,
what song did kandi burruss write,,
what are mollys,,
can i see my hemmorhoids,,
how long can bleeding after period last,,
in what city is lourdes in france located,,
who is sylvester,,
what team is ken norton working for,,
how much water do dogs need,,
which is the most common inherited bleeding disorder?,,
who wrote comedy plays in ancient greece,,
what is the smallest height in the world,,
who sings my little runaway,,
mirror definition,,
meaning of samurai in japanese,,
what is a wet nurse?,,
who was married to jennifer lopez,,
symptoms of extreme urinary frequency with ovarian cancer?,,
effexor for menopause symptoms,,
where are magp[ies,,
where was curt schilling born,,
what does paternalism do,,
what is a turp,,
why name renesmee,,
where is rickie fowler,,
what house is rose weasley in,,
what school did michael jordan go to,,
who did obama award medal of honors to,,
who is the designer of gucci who was killed,,
was the florida shooter a registered democrat,,
how long is a formula bottle good for,,
what was hitler's reaction to the terms of the treaty of versailles,,
what states have reported zika in the united states,,
where was doris day born and raised,,
won is michael jackson's birthday?,,
what mean goer,,
how many months in a year song,,
when should i take my kids in to see doctor when they have fever,,
is mr. bean dead,,
what is the ear acupuncture for,,
host of hln,,
is Jordan spieth a christian,,
who is rob zombie,,
how long are lionesses pregnant,,
what was the name of the group that opposed johnson in reconstruction,,
who opened the first research laboratory,,
are black widow spiders dangerous,,
does injection methotrexate reduce side effects,,
who is marianne faithfull,,
what class was uss texas,,
how many books has avi written,,
how long do instagram users spend per visit,,
what is a physicalh eunich,,
where is cocoa grown,,
once upon a time season 4 cast,,
define verdure,,
what is eloise greenfield achievements,,
which antacid during pregnancy,,
how old is oscar von memerty,,
vaginal dryness causes,,
who is nick lachey,,
most career wins by a coach in nba,,
how long does pitbulls live for,,
who is neil armstrong,,
what is your last name nicholas in german,,
who is renee lane,,
what did walt disney draw,,
who sings the beach song do the bop,,
um what's the happiest people in the world.,,
francisco pizarro definition,,
mcm instagram meaning,,
how old is brian johnson,,
how many weeks is considered a miscarriage,,
how did wilson die,,
what is kuudere,,
ruksana name meaning,,
can you have a period after menopause,,
vita sidorkina listal,,
newest disney princess,,
when will gambit be released,,
is valsartan a diuretic,,
what year did jim croce die,,
what food contain glutamic acid,,
how long does it take for a missed miscarriage to pass naturally from when bleeding starts,,
what does mnpt mean,,
who is chaucer,,
how did martin luther king jr changed history,,
alma matters what does it mean,,
how much gas does hyundai sonata takes,,
what would you feed a newborn kitten in emergency,,
feeling sick early pregnancy symptoms,,
ferrari car price,,
cardi b how old,,
lu surname meaning,,
who is vlad the impaler,,
what's the meaning of syncretism,,
folies-berg re definition,,
what nationality is daddy yankee,,
what is hume's theory of self,,
how did nightingale use research,,
how did paul revere die cause of death,,
what did ernest hemingway drink,,
earliest pregnancy symptoms,,
when did tolkien die?,,
who wrote land of hope and glory,,
how old is tennys sandgren,,
why is israel so important,,
how long was martin luther king's speech,,
where is kevin gates born,,
when is miguel birthday,,
what is the significance of snape's patronus,,
when does the new grey's anatomy come on,,
what are weight,n,
what is a mixer for whiskey,,
who is paul simon,,
what has protein for babies,,
who makes smart ones,,
what is the name of the actor that plays rosita,,
what does the flu shot consist of,,
what is a clapper,,
which is one way that people benefit from equal treatment under the law?,,
what are foxes like,,
revolution the beatles meaning,,
who was sylvester judd,,
who is matty johnson,,
did the eleusinian mysteries survive,,
which nfl punter has highest average punt for career,,
what type of art did wassily kandinsky paint,,
who was james dean in love with,,
where is logan square,n,
who is james roday,,
what ruin means,,
what is the meaning of aditi,,
what defines a bad parent,,
how many pounds should you gain the first few weeks of pregnancy,,
where is frisco texas,,
who plays reign on supergirl,,
when was swiss family robinson made,,
does period affect breastfeeding,,
where is shawn mendes from,,
what happens when you drink while pregnant,,
what are some of the treatments for prostate cancer,,
who is steve bing?,,
define cankle,,
menopause hot flashes how long does it last,,
what is endometrial hyperplasia unspecified,,
define uncouth,,
where is morgan run resort,,
who played vic fontaine on deep space nine,,
where did versace die,,
how tall is kate upton and weight,,
how many games did jackie robinson play,,
piquing definition,,
short term disability leave how many days,,
where was the 2013 nfl draft,,
who sang you light up my life,,
what was dropped on hiroshima and nagasaki,,
what does arista mean,,
how long does a released ovulation egg last,,
what is fiefs,,
what political party was herbert hoover part of,,
what is the diep flap precautions,,
what type of dog is martha in martha speaks,,
when was the cons france terrorist attack?,,
what helps low testosterone,,
what helps a busted lip,,
what are the we bee gees,,
what did ignaz semmelweis discover,,
who is the lead singer of lorde?,,
is g dragon gay,,
what is the ovaries,,
how old does a dog have to be to breed,,
what is a husband,,
what does crate trained mean,,
dalian developer,,
what is a prostate and where is it,,
is gabapentin harmful,,
helen mccole bartusiak,,
humphrey bogart cause of death,,
define earth,,
toddler diarrhea causes,,
meaning of cain's name,,
where are nathan's hot dogs made,,
how long can my cough last,,
who was stubby,,
how old is harrison ford?,,
sue desmond-hellmann salary,,
how tall is tupac,,
can endometrial polyps cause pain,,
how did christopher reeve die,,
what does floating horse's teeth mean,,
how many puppies in a bichon frise litter,,
why has target changed their color,,
how did the roosevelt corollary subvert the monroe doctrine?,,
how long ago were the vikings exploring,,
who makes smurfs movies,,
what is the symptoms of a prolapse,,
how to wear hair with off shoulder dress,,
when was ancient egypt,,
what does prolactin do,,
who sings sugar sugar,,
what role did navarro play in the texas independence,,
who sang higher ground,,
what kind of car does macaulay culkin drive,,
who is ileana ros lehtinen,,
which english city was shakespeare born,,
what does it mean when your period is really lite,,
how much pounds will gain during pregnancy,,
what did john locke value,,
is cancer in situ localized,,
who is geronimo stilton,,
when did daniel keyes die,,
who is ted mosby,,
solitary definition jail,,
who invented duct tape wiki,,
what is the urban definition of a princess,,
where is tory larenz from,,
cast of hansel and gretel,,
what does sabotage mean,,
who is the chairman's uncle on iron chef america?,,
do you count your pregnancy weeks by conception or missed period,,
body temperature pregnancy symptom,,
which of the following explorers led a voyage that ultimately circumnavigated the globe?,,
where is norma,n,
define the location of the human liver,,
where is punjab,,
is there a trent state park in pa,,
who is john o' neil,,
